{
  "$schema": "https://json-schema.org/draft/2020-12/schema",
  "$id": "https://example.com/schemas/runtime_integration.schema.json",
  "title": "RuntimeIntegrationConfig",
  "type": "object",
  "required": [
    "version",
    "vlm",
    "detector"
  ],
  "properties": {
    "version": {
      "type": "string"
    },
    "defaults_file": {
      "type": [
        "string",
        "null"
      ]
    },
    "thresholds_file": {
      "type": [
        "string",
        "null"
      ]
    },
    "vlm": {
      "type": "object",
      "required": [
        "mode",
        "provider",
        "timeout_seconds",
        "max_retries",
        "response_format",
        "image_transport",
        "system_prompt"
      ],
      "properties": {
        "mode": {
          "type": "string",
          "enum": [
            "fixture",
            "live"
          ]
        },
        "provider": {
          "type": "string",
          "enum": [
            "codex_cli",
            "openai_compatible",
            "openai_responses"
          ]
        },
        "base_url": {
          "type": [
            "string",
            "null"
          ]
        },
        "endpoint_path": {
          "type": [
            "string",
            "null"
          ]
        },
        "api_key_env": {
          "type": [
            "string",
            "null"
          ]
        },
        "model": {
          "type": [
            "string",
            "null"
          ]
        },
        "timeout_seconds": {
          "type": "number",
          "minimum": 1.0
        },
        "max_retries": {
          "type": "integer",
          "minimum": 0
        },
        "temperature": {
          "type": [
            "number",
            "null"
          ],
          "minimum": 0.0,
          "maximum": 2.0
        },
        "reasoning_effort": {
          "type": [
            "string",
            "null"
          ],
          "enum": [
            "none",
            "low",
            "medium",
            "high",
            "xhigh",
            null
          ]
        },
        "response_format": {
          "type": "string",
          "enum": [
            "json_object",
            "none"
          ]
        },
        "max_tokens": {
          "type": [
            "integer",
            "null"
          ],
          "minimum": 1
        },
        "image_transport": {
          "type": "string",
          "enum": [
            "data_url",
            "file_path"
          ]
        },
        "system_prompt": {
          "type": "string"
        },
        "command": {
          "type": [
            "string",
            "null"
          ]
        },
        "profile": {
          "type": [
            "string",
            "null"
          ]
        },
        "sandbox": {
          "type": [
            "string",
            "null"
          ],
          "enum": [
            "read-only",
            "workspace-write",
            "danger-full-access",
            null
          ]
        }
      },
      "additionalProperties": false
    },
    "detector": {
      "type": "object",
      "required": [
        "mode",
        "family",
        "weights_path",
        "device",
        "confidence_threshold",
        "iou_threshold",
        "max_det",
        "refine_match_iou",
        "missing_match_iou"
      ],
      "properties": {
        "mode": {
          "type": "string",
          "enum": [
            "proxy",
            "live"
          ]
        },
        "family": {
          "type": "string"
        },
        "weights_path": {
          "type": "string"
        },
        "device": {
          "type": "string"
        },
        "confidence_threshold": {
          "type": "number",
          "minimum": 0.0,
          "maximum": 1.0
        },
        "iou_threshold": {
          "type": "number",
          "minimum": 0.0,
          "maximum": 1.0
        },
        "max_det": {
          "type": "integer",
          "minimum": 1
        },
        "refine_match_iou": {
          "type": "number",
          "minimum": 0.0,
          "maximum": 1.0
        },
        "missing_match_iou": {
          "type": "number",
          "minimum": 0.0,
          "maximum": 1.0
        }
      },
      "additionalProperties": false
    }
  },
  "additionalProperties": false
}
